{
  "extraction_id": "bbab36b6",
  "filename": "2795115_E14_SEN_X_01_001_003_XX_01_035_X_XXX.pdf",
  "success": true,
  "processing_time_ms": 28807,
  "corporacion": "SENADO",
  "departamento": "ANTIOQUIA",
  "municipio": "MEDELLIN",
  "zona": "03",
  "puesto": "I.E. ASIA IGNACIANA",
  "mesa": "035",
  "partidos": [
    {
      "party_name": "REGISTRADURÍA",
      "party_code": "",
      "votes": 1,
      "confidence": 0.5,
      "needs_review": true
    },
    {
      "party_name": "COALICIÓN ALIANZA VERDE Y CENTRO ESPERANZA",
      "party_code": "",
      "votes": 255,
      "confidence": 0.75,
      "needs_review": false
    },
    {
      "party_name": "FUERZA CIUDADANA LA FUERZA DEL CAMBIO",
      "party_code": "",
      "votes": 1,
      "confidence": 0.75,
      "needs_review": false
    },
    {
      "party_name": "PARTIDO LIBERAL COLOMBIANO",
      "party_code": "",
      "votes": 1,
      "confidence": 0.75,
      "needs_review": false
    },
    {
      "party_name": "LISTA CON VOTO PREFERENT",
      "party_code": "",
      "votes": 1,
      "confidence": 0.5,
      "needs_review": true
    },
    {
      "party_name": "SIN VOTO PREFERENT",
      "party_code": "",
      "votes": 1,
      "confidence": 0.5,
      "needs_review": true
    }
  ],
  "total_votos": 260,
  "votos_blancos": 0,
  "votos_nulos": 0,
  "confidence": 1.0,
  "raw_text": "A iio > '\nA |\n¡\nV ) 710597822010111 Vet: 01 Pag: 01 de 11 |\nACTA DE ESCRUTINIO DE LOS 7 |\n[m] ys O JURADOS DE VOTACION\nA] : e DELEGADOS |\nMA E ELECCIONES CONGRESO |\nra E 13 DE MARZO DE 2022 ES\nA E REGISTRADURÍA 1\n[(m] Eh ]> SENADO !\nDEPARTAMENTO: 01 - ANTIOQUIA ]\nMUNICIPIO: 001 - MEDELLIN\nLUGAR: I.E. ASIA IGNACIANA\nZONA: 03 PUESTO: 01 MESA: 035\nX 2-79-51-15 X |\nTOTAL TOTAL TOTAL\nSUFRAGANTES VOTOS VOTOS ¡\nFORMATO E-11 EN LA URNA INCINERADOS '\ne MZA [AA |\nVOTOS POR LA AGRUPACIÓN POLÍTICA mum — ll 0\n\n:\n\n¡\n\n|\n\n'\n\n| ¡\n\n¡\n\ny\n\n:\n\n¡\n\nV\n\n'\n\nMl No, Form: 59782 K1T 59,782 Civ1218313 MM 1\n\n--- PAGE BREAK ---\nMl !\na e\nk, , 710597822010211 Ver”01 Pag: 02 de 11 |\nAGTA DE ESCRUTINIO DE LOS EA\n\nJURADOS DE VOTACIÓN l\nPO DELEGADOS Ml |\nAma ELECCIONES CONGRESO\nz Eje 13 DE MARZO DE-2022 2\n[min SENADO E\n'\nDEPARTAMENTO: 01 - ANTIOQUIA |\nMUNICIPIO: 001 - MEDELLIN\nLUGAR: 1.E. ASIA IGNACIANA ¡\nZONA: 03 PUESTO: 01 MESA: 035 |\nX 2-79-51-15 X |\no LISTACON VOTO PREFERENTE... |\n0255 [| COALICIÓN ALIANZA VERDE Y CENTRO ESPERANZA |\n\n0 _ — f VOTOS SOLO POR LA AGRUPACIÓN POLÍTICA 0\neS == [n\n3 A o A]\n\n00 o e cl A a ¡\nLL cn o ARCO a o a\nO a cl o a :\n==> Es\nSIS\na A lr ol a A\nls oler 2 e E]\nMS a A\nMESS Dal\nAA ]\n\nal =9 o\n\nE AA\n\nEE a E\n\nss a AL\n\n59 == — 0\nses\nISS EN\nEs A A\n64 => A | 1\n\nAH RRA ]\nTOTAL = VOTOS AGRUPACIÓN + VOTOS CANDIDATOS 0 |\n\n|\n\nMM No, Form: 59782 KIT 59,782 Civ1218314 Ml |\n\n--- PAGE BREAK ---\na e\n| ] 710597822010311  Ver?01 Pag: 03 de 11 :\nACTA: ESCRUTINIO DELOS EA\n\nú JURADOS DE VOTACIÓN 1\nAba Ll DELEGADOS o 0\ncata rERY ELECCIONES CONGRESO |\nde 13 DE MARZO DE 2022 ¡E |\nOle hat SENADO a N\n”\nDEPARTAMENTO: 01 - ANTIOQUIA\nMUNICIPIO: 001 - MEDELLIN 1\nLUGAR: I.E. ASIA IGNACIANA |\nZONA: 03 PUESTO: 01 MESA: 035 |\n|\n\nX 2-79-51-15 X 0\n\npo LISTACON VOTO PREFERENTE |\n1100 FUERZA CIUDADANA LA FUERZA DEL CAMBIO 1\n\n__ qn\n\n0 o «E VOTOS SOLO POR LA AGRUPACIÓN POLÍTICA 1\ncd AA =—]\na [| psa | Oia\nERAKAA E :\nAs A er | 0\nEXE\n\nMOE AAA AA :\nES PRE V\na == A o\nCO E CA ET\n1 ==> LT\n- | E\no acces |\n== MIE ce)\nE EOS\nDre=iE 20 Ko o\ne ES DISE=n=E=\no A o o A\n\na e |\nOsa a a\nCAR A o 0 0 a\nas lp os [Ll on :\n208 fs Ml ¡a E ¡\nMA\nA o !\nTOTAL = VOTOS AGRUPACIÓN + VOTOS CANDIDATOS — LD ¡\n\n¡\n\n¡\n\na No. Form: 59782 KIT 59,782 Civ1218315 M\n\n--- PAGE BREAK ---\nA _\n710597822010411 Ver: 01 Pag: 04 de 11 !\nACTA DE ESCRUTINIO DE LOS l Eta |\n[m] regar ra] JURADOS DE VOTACIÓN :\npoe Fora DELEGADOS o |\nE E ELECCIONES CONGRESO\nEa: 13 DE MARZO DE 2022 E |\nOltra SENADO a |\nDEPARTAMENTO: 01 - ANTIOQUIA 1\nMUNICIPIO: 001 - MEDELLIN |\nLUGAR: 1.E. ASIA IGNACIANA y\nZONA: 03 PUESTO: 01 MESA: 035 |\nX 2-79-51-15 X | !\ni 2 \"LISTACON VOTO PREFERENTE\nPARTIDO CAMBIO RADICAL |\n0 A — «Em=mw= VOTOS SOLO POR LA AGRUPACIÓN POLÍTICA |\na AO As lo]\na lol ss io o A\nA AAA la la\n> E 2 po\n| pl os | — a llo]\nlA le A AAA]\nAG lA AAA]\ndl rl rs Am]\nAE al >\no lla sl q AA\nE cd MU Da o al O\n12 A NEON 8D |\nMEA\nMi AS\nts | tl ss lo y as [Ao]\nas oo lA o o Y\nDES DE=S n=)\na IA\na lA A ao a plo\nPSA ICAA\nAA\na E a Po\nMA ¡\n2 ll o ol la Ao]\ndesa)\nAA A AAA\na bo ese laicas las lo\na | lol os lr — olmo]\nas lo A\nTOTAL = VOTOS AGRUPACIÓN + VOTOS CANDIDATOS\nTT LISTA SIN VOTO PREFERENTE\n(sos SALUD SOS € SLOMBIA. SECTOR ORGANIZADO DE LA\n0 o VOTOS POR LA AGRUPACIÓN POLÍTICA mum |— |— |]\n-  HISTASIN VOTO PREFERENTE\nJa [e eennnosienio\na orosreriarcmmcin ram > JETA\nMl Ho. Form: 55782 KIT 59,782 Civ1218316 MM\n\n--- PAGE BREAK ---\nA e\n. . 710597822010511 Ver: 01 Pag: 05 de 11 |\nACTA DE ESCRUTINIO DE LOS Eta 0\n\nMy 2 JURADOS DE VOTACION ,\nCAN DELEGADOS o |\n¿e Pr ELECCIONES CONGRESO\nE PL SRtio 13 DE MARZO DE 2022 1\nObi dessr SENADO A\nDEPARTAMENTO: 01 - ANTIOQUIA |\nMUNICIPIO: 001 - MEDELLIN |\nLUGAR: 1.E. ASIA IGNACIANA\nZONA: 03 PUESTO: 01 MESA: 035 |\nX 2-79-51-15 X |\nSTA SIN VOTO PREFERENTE\ne 1190 ESTAMOS LISTAS COLOMBIA )\n\n0 VOTOS POR LA AGRUPACIÓN POLÍTICA \"mm A |\no l LISTA SIN VOTO PREFERENTE\nMOVIMIENTO UNITARIO METAPOLITICO\n\no [O vorasromarcrcinama > [AH\n— LISTA CON VOTO PREFERENTE\n\nElsa 02 COALICIÓN MIRA - COLOMBIA JUSTA LIBRES |\nATA EU vorossoron aromas | |\n23 000 Co o Das\ntl\n\naloiolala o — 4 os [| Hb\nAAA e adan 0 PRE TA\nlA Y pe\nESOS\nAPPS ES\nCA RA\nIES\nHair==>==> O a o\nMES ESO =p\nO\nE MEN\nE ns nsee\n!\n\n=== 0=Ec O\na E == !\nAE A\nA E MEE a KA\nTOTAL = VOTOS AGRUPACIÓN + VOTOS CANDIDATOS |\n\nMo. 0cm: 50702 KIT 59,782 civizisa1i7 MN |\n\n--- PAGE BREAK ---\n- an e\n|\n\n: ' 710597822010611 Ver: 01 Pag: 06 de 11 |\nACTA DE TACIÓN > Eta 7\n\nEr JURADOS DE VOTACI |\nde DELEGADOS o :\no SENADO A\n|\n\n|\n\nDEPARTAMENTO: 01 - ANTIOQUÍA\nMUNICIPIO: 001 - MEDELLIN 1\nLUGAR: |.E. ASIA IGNACIANA\nZONA: 03 PUESTO: 01 MESA: 035 |\nX 2-79-51-15 X |\n\n2 LISTACON VOTO PREFERENTE |\nPA 000 PARTIDO LIBERAL COLOMBIANO 1\n\n— a |\n\n0 —im|i2_| 6 votos SOLO PORLA AGRUPACIÓN POLÍTICA |\nA AAA ss A HA\na A a AE\n22 as | E a ET\nAAA HA OE=3\nA\nMA E\nA A\n3 es LR AE\n\nSS OS\na a\no == |\nA\ne | DE= o\nA O O\nA E\nOe\n= ES SS\n+ AA AA\n==> PSIiE=S=\n26 O .\n2 => HE HA\nss PS == i\nHD\nCA\n==> CA A\nESS == AE\n| A\nTOTAL = VOTOS AGRUPACIÓN + VOTOS CANDIDATOS\nTT UUISTA SIN VOTO PREFERENTE. 2... >>>.\n\nVOTOS POR LA AGRUPACIÓN POLÍT",
  "warnings": [
    "Total calculated from party votes"
  ],
  "error": null
}